{
  "$schema": "https://json-schema.org/draft/2020-12/schema",
  "$id": "https://super-editor.local/schemas/semantic-rule-pack-v1.json",
  "title": "Super Editor semantic teaching-aid rule pack",
  "type": "object",
  "additionalProperties": false,
  "required": ["schema_version", "identity", "applicability", "templates", "defaults", "rules", "acceptance", "training", "forward_tests"],
  "properties": {
    "schema_version": { "const": 1 },
    "identity": {
      "type": "object",
      "additionalProperties": false,
      "required": ["skill_name", "display_name", "version", "status", "book_family"],
      "properties": {
        "skill_name": { "type": "string", "pattern": "^[a-z0-9]+(?:-[a-z0-9]+)*$", "maxLength": 63 },
        "display_name": { "type": "string", "minLength": 1 },
        "version": { "type": "string", "pattern": "^[0-9]+\\.[0-9]+\\.[0-9]+$" },
        "status": { "enum": ["draft", "trial_approved", "validated", "deprecated"] },
        "book_family": { "type": "string", "minLength": 1 }
      }
    },
    "applicability": { "$ref": "#/$defs/applicability" },
    "templates": {
      "type": "object",
      "additionalProperties": false,
      "required": ["default", "variants"],
      "properties": {
        "default": { "$ref": "#/$defs/template" },
        "variants": { "type": "array", "items": { "$ref": "#/$defs/templateVariant" } }
      }
    },
    "defaults": {
      "type": "object",
      "additionalProperties": false,
      "required": ["style_policy", "on_missing", "on_ambiguous"],
      "properties": {
        "style_policy": { "$ref": "#/$defs/stylePolicy" },
        "on_missing": { "$ref": "#/$defs/failurePolicy" },
        "on_ambiguous": { "$ref": "#/$defs/ambiguityPolicy" },
        "module_policy": { "$ref": "#/$defs/modulePolicy" }
      }
    },
    "rules": { "type": "array", "minItems": 1, "items": { "$ref": "#/$defs/rule" } },
    "acceptance": { "type": "array", "minItems": 1, "items": { "$ref": "#/$defs/validation" } },
    "training": {
      "type": "object",
      "additionalProperties": false,
      "required": ["feedback", "examples"],
      "properties": {
        "feedback": { "type": "array", "items": { "$ref": "#/$defs/feedback" } },
        "examples": { "type": "array", "items": { "$ref": "#/$defs/example" } }
      }
    },
    "forward_tests": { "type": "array", "items": { "$ref": "#/$defs/forwardTest" } }
  },
  "$defs": {
    "hash": { "type": ["string", "null"], "pattern": "^sha256:[a-f0-9]{64}$" },
    "applicability": {
      "type": "object",
      "additionalProperties": false,
      "required": ["intent"],
      "properties": {
        "intent": { "type": "string", "minLength": 1 },
        "include": { "type": "object" },
        "exclude": { "type": "object" }
      }
    },
    "template": {
      "type": "object",
      "additionalProperties": false,
      "required": ["template_id", "intent"],
      "properties": {
        "template_id": { "type": ["string", "integer"] },
        "intent": { "type": "string", "minLength": 1 },
        "snapshot_hash": { "$ref": "#/$defs/hash" },
        "anchors": { "type": "array", "items": { "$ref": "#/$defs/anchor" } }
      }
    },
    "templateVariant": {
      "type": "object",
      "additionalProperties": false,
      "required": ["id", "priority", "when", "template_id", "intent"],
      "properties": {
        "id": { "type": "string", "pattern": "^[a-z0-9][a-z0-9_-]*$" },
        "priority": { "type": "integer" },
        "when": { "type": "string", "minLength": 1 },
        "template_id": { "type": ["string", "integer"] },
        "intent": { "type": "string", "minLength": 1 },
        "snapshot_hash": { "$ref": "#/$defs/hash" },
        "anchors": { "type": "array", "items": { "$ref": "#/$defs/anchor" } }
      }
    },
    "cardinality": {
      "type": "object",
      "additionalProperties": false,
      "required": ["min", "max"],
      "properties": {
        "min": { "type": "integer", "minimum": 0 },
        "max": { "type": ["integer", "null"], "minimum": 0 }
      }
    },
    "anchor": {
      "type": "object",
      "additionalProperties": false,
      "required": ["kind", "value"],
      "properties": {
        "kind": { "type": "string", "minLength": 1 },
        "value": {},
        "optional": { "type": "boolean" },
        "intent": { "type": "string" }
      }
    },
    "selector": {
      "type": "object",
      "additionalProperties": false,
      "required": ["role", "cardinality"],
      "properties": {
        "role": { "type": "string", "minLength": 1 },
        "cardinality": { "$ref": "#/$defs/cardinality" },
        "anchors": { "type": "array", "items": { "$ref": "#/$defs/anchor" } },
        "include": { "type": "string" },
        "exclude": { "type": "string" }
      }
    },
    "stylePolicy": { "enum": ["preserve_target", "copy_source_rich_text", "hybrid", "none"] },
    "modulePolicy": { "enum": ["reuse_model_relation", "clone_if_supported", "none"] },
    "failurePolicy": { "enum": ["stop", "needs_review", "skip", "keep_target"] },
    "ambiguityPolicy": { "enum": ["stop", "needs_review", "skip"] },
    "action": {
      "type": "object",
      "additionalProperties": false,
      "required": ["type", "intent", "required_capabilities"],
      "properties": {
        "type": { "type": "string", "minLength": 1 },
        "intent": { "type": "string", "minLength": 1 },
        "required_capabilities": { "type": "array", "minItems": 1, "items": { "type": "string", "minLength": 1 } },
        "content_policy": { "type": "string" },
        "style_policy": { "$ref": "#/$defs/stylePolicy" },
        "module_policy": { "$ref": "#/$defs/modulePolicy" },
        "selection_policy": { "type": "string" },
        "layout_policy": { "type": "string" },
        "parameters": { "type": "object" },
        "steps": { "type": "array", "items": { "$ref": "#/$defs/action" } }
      }
    },
    "validation": {
      "type": "object",
      "additionalProperties": false,
      "required": ["id", "intent", "severity", "required_capabilities"],
      "properties": {
        "id": { "type": "string", "minLength": 1 },
        "intent": { "type": "string", "minLength": 1 },
        "severity": { "enum": ["error", "warning"] },
        "required_capabilities": { "type": "array", "items": { "type": "string", "minLength": 1 } }
      }
    },
    "rule": {
      "type": "object",
      "additionalProperties": false,
      "required": ["id", "order", "intent", "when", "scope", "source", "target", "action", "on_missing", "on_ambiguous", "validate"],
      "properties": {
        "id": { "type": "string", "pattern": "^[a-z0-9][a-z0-9_-]*$" },
        "order": { "type": "integer" },
        "intent": { "type": "string", "minLength": 1 },
        "when": { "type": "string", "minLength": 1 },
        "scope": { "$ref": "#/$defs/applicability" },
        "source": { "$ref": "#/$defs/selector" },
        "target": { "$ref": "#/$defs/selector" },
        "action": { "$ref": "#/$defs/action" },
        "on_missing": { "$ref": "#/$defs/failurePolicy" },
        "on_ambiguous": { "$ref": "#/$defs/ambiguityPolicy" },
        "validate": { "type": "array", "minItems": 1, "items": { "$ref": "#/$defs/validation" } }
      }
    },
    "feedback": {
      "type": "object",
      "additionalProperties": false,
      "required": ["id", "classification", "summary", "confirmed"],
      "properties": {
        "id": { "type": "string", "minLength": 1 },
        "classification": { "enum": ["instance_fix", "rule_refinement", "new_variant", "acceptance_refinement"] },
        "summary": { "type": "string", "minLength": 1 },
        "confirmed": { "type": "boolean" },
        "promoted_to_rule_ids": { "type": "array", "items": { "type": "string" } }
      }
    },
    "example": {
      "type": "object",
      "additionalProperties": false,
      "required": ["id", "kind", "description"],
      "properties": {
        "id": { "type": "string", "minLength": 1 },
        "kind": { "enum": ["positive", "negative"] },
        "description": { "type": "string", "minLength": 1 },
        "rule_ids": { "type": "array", "items": { "type": "string" } }
      }
    },
    "forwardTest": {
      "type": "object",
      "additionalProperties": false,
      "required": ["id", "source_label", "status", "evidence"],
      "properties": {
        "id": { "type": "string", "minLength": 1 },
        "source_label": { "type": "string", "minLength": 1 },
        "status": { "enum": ["pending", "passed", "failed", "needs_review"] },
        "evidence": { "type": "array", "items": { "type": "string" } },
        "result_hash": { "$ref": "#/$defs/hash" }
      }
    }
  }
}
